"","index","genres","keywords","title"
"3321",3320,"Comedy","infidelity con man thief independent film business","Extract"
"3322",3321,"Drama Music","journalist musical concert independent film","Masked and Anonymous"
"3323",3322,"Drama Thriller Crime Foreign","","Betty Fisher and Other Stories"
"3324",3323,"Drama Romance Science_Fiction Thriller","seattle shanghai future insurance salesman dystopia","Code 46"
"3325",3324,"Comedy","racehorse","Outside Bet"
"3326",3325,"Drama","butler dublin maid","Albert Nobbs"
"3327",3326,"Drama Action Crime","","Black November"
"3328",3327,"Family Comedy Romance","new york from rags to riches family relationships bollywood racer","Ta Ra Rum Pum"
"3329",3328,"Animation Drama","civil war parents kids relationship 1970s puberty totalitarian regime","Persepolis"
"3330",3329,"Thriller Adventure Fantasy","basement hole little brother","The Hole"
"3331",3330,"Drama Thriller","dictator trainer classroom fascism group dynamics","The Wave"
"3332",3331,"Thriller Horror","model","The Neon Demon"
"3333",3332,"Thriller Crime Drama Action","self-defense widower","Harry Brown"
"3334",3333,"Horror Thriller","bible suspense biblical code revelation (book)","The Omega Code"
"3335",3334,"Comedy Drama Romance","sexuality becoming an adult puberty first time oscar award","Juno"
"3336",3335,"Action","","Pound of Flesh"
"3337",3336,"Adventure Action Thriller","spy fight secret organization satellite secret agent","Diamonds Are Forever"
"3338",3337,"Drama Crime","italy love at first sight loss of father patriarch organized crime","The Godfather"
"3339",3338,"Drama Music Romance","dancing dance locksmith welder","Flashdance"
"3340",3339,"Comedy Drama Romance","date sex jealousy fight architect","(500) Days of Summer"
"3341",3340,"Drama Romance","love triangle scotland mother adultery sexuality","The Piano"
"3342",3341,"Drama Comedy","dancing florida strip club male stripper novice","Magic Mike"
"3343",3342,"Thriller Horror","witch loss of mother small town death penalty lighthouse","Darkness Falls"
"3344",3343,"Adventure Action Thriller","london england new york bomb england spy","Live and Let Die"
"3345",3344,"Comedy Drama Family","mississippi childhood memory dog","My Dog Skip"
"3346",3345,"Comedy Romance","lovesickness love of one's life narration lovers kiss","Definitely, Maybe"
"3347",3346,"Comedy","african american wedding class differences martha's vineyard","Jumping the Broom"
"3348",3347,"Drama History","telecaster communist political activism tv show politician","Good Night, and Good Luck."
"3349",3348,"Crime Drama","gay self-fulfilling prophecy based on novel journalism identity","Capote"
"3350",3349,"Thriller Action Crime","gunslinger anti terror ambush mexico showdown","Desperado"
"3351",3350,"Adventure Action Romance Science_Fiction","female nudity killer robot nudity utopia teleportation","Logan's Run"
"3352",3351,"Adventure Action Thriller","london england england martial arts assassin exotic island","The Man with the Golden Gun"
"3353",3352,"Action Adventure Comedy Crime Drama","showdown suspicion of murder boxer suspension organized crime","Action Jackson"
"3354",3353,"Adventure Horror","mutant expedition cave darkness rope","The Descent"
"3355",3354,"Documentary","sport","Michael Jordan to the Max"
"3356",3355,"Horror","found footage","Devil's Due"
"3357",3356,"Comedy Romance","lsd looking for  birth parents half-brother independent film","Flirting with Disaster"
"3358",3357,"Drama Horror Crime","sadistic killing fire sheriff bounty hunter","The Devil's Rejects"
"3359",3358,"Crime Drama Comedy","california hip-hop harvard university geek coming of age","Dope"
"3360",3359,"Drama Action Thriller Crime","","In Too Deep"
"3361",3360,"Horror","upper class halloween psychopath urban legend youth","House of 1000 Corpses"
"3362",3361,"Horror Action Thriller Science_Fiction","","Alien Zone"
"3363",3362,"Comedy Drama","professor dark comedy telephone call aftercreditsstinger 1960s","A Serious Man"
"3364",3363,"Comedy Drama Mystery","independent film","Get Low"
"3365",3364,"Adventure Comedy Fantasy Horror","witch cemetery magic time travel aging","Warlock"
"3366",3365,"Romance Drama","talent success musician woman director","Beyond the Lights"
"3367",3366,"Drama Romance","gay based on novel suicidal death of lover teacher student relationship","A Single Man"
"3368",3367,"Drama","christianity traitor jesus christ roman crucifixion","The Last Temptation of Christ"
"3369",3368,"Romance Comedy Drama","suicide sex sexuality college police","Outside Providence"
"3370",3369,"Drama Comedy Music Romance","indian lead bollywood modern day adaptation pride & prejudice woman director","Bride & Prejudice"
"3371",3370,"Adventure Drama Action History","child abuse sister sister relationship prosecution australia approved school ","Rabbit-Proof Fence"
"3372",3371,"Comedy","sport","Who's Your Caddy?"
"3373",3372,"Thriller Action Horror Science_Fiction Crime","flooding futuristic police detective","Split Second"
"3374",3373,"Action Adventure Drama Family","based on novel biography","The Other Side of Heaven"
"3375",3374,"Drama Romance","love of one's life pilot class society pakistan india","Veer-Zaara"
"3376",3375,"Drama","film making film producer video surveillance sport interracial marriage","Redbelt"
"3377",3376,"Comedy Drama Romance","mumblecore","Cyrus"
"3378",3377,"Drama Family","","A Dog Of Flanders"
"3379",3378,"Drama Crime","male nudity adultery based on novel infidelity tv show","Auto Focus"
"3380",3379,"Drama","new york alcohol sex infidelity nudity","Factory Girl"
"3381",3380,"Drama Thriller","suburb violence killing spree prison visit guinea pig","We Need to Talk About Kevin"
"3382",3381,"Drama Family","angel miracle village christian candle","The Christmas Candle"
"3383",3382,"Action Drama","sport catholic mother superior catholic school convent school","The Mighty Macs"
"3384",3383,"Comedy","male nudity female nudity mexico prostitute nudity","Losin' It"
"3385",3384,"Drama Romance","adoptive mother nymphomaniac mother daughter relationship","Mother and Child"
"3386",3385,"Action Adventure Drama War","gypsy middle east foreign legion wilderness archaeologist","March or Die"
"3387",3386,"Fantasy Comedy Science_Fiction","servant time travel clumsy fellow middle ages nobility","The Visitors"
"3388",3387,"Comedy Drama","milan independent film luxury hotel man in towel\u00a0 woman director","Somewhere"
"3389",3388,"Comedy Drama","female nudity based on novel stripper flop dark comedy","I Hope They Serve Beer in Hell"
"3390",3389,"Comedy","inventor invention scandal","Chairman of the Board"
"3391",3390,"Drama","loss of mother clerk grocery loss of relative loss of wife","Hesher"
"3392",3391,"Comedy Crime Drama","growing up money crime fatherhood","Dom Hemingway"
"3393",3392,"Mystery Drama Adventure","desperation highway wilderness getting lost friendship","Gerry"
"3394",3393,"Drama Romance","","The Heart of Me"
"3395",3394,"Romance Drama","new jersey equality lesbian relationship cancer","Freeheld"
"3396",3395,"Comedy","independent film woman director","The Extra Man"
"3397",3396,"Drama Science_Fiction","","Hard to Be a God"
"3398",3397,"Crime Thriller Comedy","independent film money","Ca$h"
"3399",3398,"Drama","adultery brain tumor south africa alcoholism divorce","Wah-Wah"
"3400",3399,"Action Thriller Crime","arbitrary law boston twin brother russian mafia prologue","The Boondock Saints"
"3401",3400,"Crime Thriller","","Z Storm"
"3402",3401,"Horror Thriller","sheriff vampire orphanage writer edgar allen poe","Twixt"
"3403",3402,"Animation Fantasy","","The Snow Queen"
"3404",3403,"Family Animation Comedy Adventure","","Alpha and Omega: The Legend of the Saw Tooth Cave"
"3405",3404,"Romance Western","gunslinger showdown marshal blackmail mine","Pale Rider"
"3406",3405,"Adventure Science_Fiction","wormhole space travel supernatural powers spaceship alien","Stargate: The Ark of Truth"
"3407",3406,"Comedy Drama","1970s texas high school comedy coming of age","Dazed and Confused"
"3408",3407,"Comedy Drama Family Music","musical music summer teenager summer job","High School Musical 2"
"3409",3408,"Drama Romance","small town lovers bear north pole","Two Lovers and a Bear"
"3410",3409,"Thriller Crime Drama","mobster money problems borrow trouble classmates","Criminal Activities"
"3411",3410,"Drama History Romance","berlin jew forbidden love lesbian relationship homosexuality","Aimee & Jaguar"
"3412",3411,"Comedy Drama","suicide father son relationship surreal independent film parallel world","The Chumscrubber"
"3413",3412,"Action Thriller Crime","","Shade"
"3414",3413,"Horror Thriller","mother daughter relationship cross dressing violence mother son relationship father son conflict","House at the End of the Street"
"3415",3414,"Drama War Mystery","prison middle east rape muslim militia","Incendies"
"3416",3415,"Drama Comedy Romance","eroticism","Remember Me, My Love"
"3417",3416,"Action Comedy Crime Drama","suspense","Perrier’s Bounty"
"3418",3417,"Drama Action Crime","slum police brutality brazilian war on drugs rio de janeiro","Elite Squad"
"3419",3418,"Horror","prequel evil doll killer doll spin off doll","Annabelle"
"3420",3419,"Comedy Drama Foreign Romance","musical woman director","Bran Nue Dae"
"3421",3420,"Crime Drama","street gang black people rap music hip-hop street war","Boyz n the Hood"
"3422",3421,"Drama Music","musical death dying young nostalgic mexican american","La Bamba"
"3423",3422,"Comedy Drama Romance","","The Four Seasons"
"3424",3423,"Horror Mystery Thriller","transvestism taxi prostitute subway shower","Dressed to Kill"
"3425",3424,"Action Adventure Drama Family","southern accent wanted man lynch mob reflection in water lesson","The Adventures of Huck Finn"
"3426",3425,"Crime Comedy Thriller","ecstasy drug dealing drug reference to family circus high","Go"
"3427",3426,"Comedy Drama Romance","midlife crisis marriage money divorce fashion","Friends with Money"
"3428",3427,"Science_Fiction Thriller","nasa new mexico biological weapon epilepsy secret lab","The Andromeda Strain"
"3429",3428,"Horror Thriller","mutation bat attack closed mine bat attack","Bats"
"3430",3429,"Drama","loss of family emigration world war ii jew national socialism","Nowhere in Africa"
"3431",3430,"Drama","pornography brother sister relationship sex addiction new york city thirty something","Shame"
"3432",3431,"Drama Thriller Crime","kidnapping ecstasy drug traffic drug mule hitman","Layer Cake"
"3433",3432,"Drama","","The Work and the Glory II: American Zion"
"3434",3433,"Drama Thriller","secret organization murder environmentalism vanity film eco-terrorists","The East"
"3435",3434,"Romance Drama","gay aids based on novel art house tantrum","A Home at the End of the World"
"3436",3435,"Drama Comedy Foreign","alcohol cocaine daughter road trip independent film","Aberdeen"
"3437",3436,"Drama History","independent film wounded soldier iraq war","The Messenger"
"3438",3437,"Action Drama Thriller Adventure","","Tracker"
"3439",3438,"Drama","manchester city medicine new love epilepsy wife","Control"
"3440",3439,"Action Thriller Science_Fiction","saving the world artificial intelligence rebel cyborg shotgun","The Terminator"
"3441",3440,"Comedy Drama Romance","bureaucracy berlin wall police state coma loss of mother","Good bye, Lenin!"
"3442",3441,"Drama","england leeds united sport brighton soccer","The Damned United"
"3443",3442,"Comedy Horror","female nudity crematorium nudity punk company","The Return of the Living Dead"
"3444",3443,"Romance Comedy","sex game show slacker shopping mall","Mallrats"
"3445",3444,"Romance","flying car street gang running graduation musical","Grease"
"3446",3445,"Drama War Action","famous score hero mine vietnam war village","Platoon"
"3447",3446,"Documentary","usa president jihad saudi arabia war on terror iraq","Fahrenheit 9/11"
"3448",3447,"History Drama Western Crime","wyoming historical figure loot sharing","Butch Cassidy and the Sundance Kid"
"3449",3448,"Comedy Family Fantasy","london england dancing parents kids relationship bank brother sister relationship","Mary Poppins"
"3450",3449,"Drama","post traumatic stress  disorder depression suicide attempt grief dysfunctional family","Ordinary People"
"3451",3450,"Crime Drama Music","slum street gang love at first sight showdown puerto rican","West Side Story"
"3452",3451,"Comedy","golf underwear sport golf course gopher","Caddyshack"
"3453",3452,"Comedy Drama Romance","independent film track and field gangster rap","The Brothers"
"3454",3453,"Comedy Drama Romance","","The Wood"
"3455",3454,"Drama Crime Thriller","law relatives theft criminal criminal mastermind","The Usual Suspects"
"3456",3455,"Horror Thriller","nun baby monster asylum nightmare","A Nightmare on Elm Street 5: The Dream Child"
"3457",3456,"Comedy Romance","male nudity female nudity sex college locker room","National Lampoon’s Van Wilder"
"3458",3457,"Drama Romance","supermarket heart attack ambition daughter wrestling","The Wrestler"
"3459",3458,"Western","half breed","Duel in the Sun"
"3460",3459,"Comedy","illinois pet shop poodle independent film mockumentary","Best in Show"
"3461",3460,"Science_Fiction Action","taxi street gang usa president war veteran hostage","Escape from New York"
"3462",3461,"Comedy Drama","musical","School Daze"
"3463",3462,"Comedy Family","competition grandfather grandson relationship vomit summer camp toilet","Daddy Day Camp"
"3464",3463,"Crime Action Comedy","journalist martial arts cook drug dealer","Mr. Nice Guy"
"3465",3464,"Comedy Music","mockumentary folk singer","A Mighty Wind"
"3466",3465,"Comedy Drama Romance","independent film commitment lobster portuguese american","Mystic Pizza"
"3467",3466,"Comedy Drama Fantasy Romance","double life commercial fantasy chance marketing","Sliding Doors"
"3468",3467,"Crime Horror Thriller","prison child abuse ku klux klan police brutality ghetto","Tales from the Hood"
"3469",3468,"Drama","dictator 1970s general kidnapping naivety","The Last King of Scotland"
"3470",3469,"Horror Thriller","sheriff barn black sequel boogeyman","Halloween 5: The Revenge of Michael Myers"
"3471",3470,"Comedy Crime Drama","prison visit funeral director funeral home amateur theater embezzlement","Bernie"
"3472",3471,"Documentary","dolphin whale killer whale imax 3d","Dolphins and Whales: Tribes of the Ocean"
"3473",3472,"Drama Romance","artist success relationship problems alcoholism independent film","Pollock"
"3474",3473,"Comedy Drama Romance","new year's eve independent film relationship woman director lower east side","200 Cigarettes"
"3475",3474,"Drama Thriller","plagiarized book stolen novel plagiarized novel aspiring writer","The Words"
"3476",3475,"Comedy Western","mexico organized crime drug lord padre aftercreditsstinger","Casa De Mi Padre"
"3477",3476,"Drama Comedy","secret fetishism stripper family secrets convict","City Island"
"3478",3477,"Action Comedy Thriller Crime","prostitute blackmail drug smuggle rural ireland dry humour","The Guard"
"3479",3478,"Comedy","sexuality college girlfriend vomit celebration","College"
"3480",3479,"Drama Romance","michigan 1970s youth family woman director","The Virgin Suicides"
"3481",3480,"Comedy Drama","parents kids relationship voice loneliness independent film singer","Little Voice"
"3482",3481,"Comedy Romance","sex first time virgin road trip playboy","Miss March"
"3483",3482,"Drama Comedy","jew independent film homeschooling family struggling actor","Wish I Was Here"
"3484",3483,"Comedy","restaurant department store kitchen love crab","Simply Irresistible"
"3485",3484,"Comedy Music","transvestism gay sex singer transgender","Hedwig and the Angry Inch"
"3486",3485,"Action","","Only the Strong"
"3487",3486,"Mystery Drama Thriller Horror","","Goddess of Love"
"3488",3487,"Drama History","","Shattered Glass"
"3489",3488,"Comedy Crime Thriller","murder independent film drug dentist","Novocaine"
"3490",3489,"Drama Thriller","rape sex airport authority assistant","The Business of Strangers"
"3491",3490,"Adventure Western","underdog robbery bounty hunter texas mexican revolution","The Wild Bunch"
"3492",3491,"Drama","coming of age marijuana summer","The Wackness"
"3493",3492,"Thriller Adventure Drama Crime","public hanging strongbox gold theft british history historic figure","The First Great Train Robbery"
"3494",3493,"Drama","independent film woman director","Morvern Callar"
"3495",3494,"Action Adventure Fantasy Science_Fiction","based on novel time travel sequel psychotronic sword and sandal","Beastmaster 2: Through the Portal of Time"
"3496",3495,"Drama","american football loss of brother funeral sport prayer","The 5th Quarter"
"3497",3496,"Drama","return suppressed past bourgeoisie mayor elections suspense","The Flower of Evil"
"3498",3497,"Drama","woman director","The Greatest"
"3499",3498,"Drama History","fan duringcreditsstinger","Snow Flower and the Secret Fan"
"3500",3499,"Drama Romance","bar motel one-night stand beer blonde","Come Early Morning"
"3501",3500,"Action Comedy","","Lucky Break"
"3502",3501,"Drama","friends playwright","Julia"
"3503",3502,"Comedy","surfing sport","Surfer, Dude"
"3504",3503,"Documentary","","Lake of Fire"
"3505",3504,"Crime Drama Thriller","alcohol sex robbery secret gun","11:14"
"3506",3505,"Action Thriller","asia island mercenary independent film jungle","Men of War"
"3507",3506,"Crime Mystery Thriller","independent film","Don McKay"
"3508",3507,"Crime Drama Thriller","partner murder on the run fugitive crime","Deadfall"
"3509",3508,"Drama Family","orphan rainbow","A Shine of Rainbows"
"3510",3509,"Action Thriller","","The Hit List"
"3511",3510,"Romance Comedy Drama","","Emma"
"3512",3511,"Horror Mystery Science_Fiction","suicide tv show hallucination tv station radio presenter","Videodrome"
"3513",3512,"Drama Comedy Romance","paris barcelona spain alcohol roommate single","The Spanish Apartment"
"3514",3513,"Drama","woman director","Song One"
"3515",3514,"Drama History War","netherlands world war ii","Winter in Wartime"
"3516",3515,"Comedy","bomb squad ex-fugitive freaky","Freaky Deaky"
"3517",3516,"Action Drama Thriller War","paris france world war ii nazis hijacking of train","The Train"
"3518",3517,"Drama Thriller","","Trade Of Innocents"
"3519",3518,"Action Crime Drama Thriller","buddhism elephant sydney australia fighter","The Protector"
"3520",3519,"Comedy","italy victorian england young woman","Stiff Upper Lips"
"3521",3520,"Comedy Drama Romance","london england tradition indian lead culture clash immigration","Bend It Like Beckham"
"3522",3521,"Drama","independent film","Sunshine State"
"3523",3522,"Action Adventure Drama","street gang black people sport high school sports","Crossover"
"3524",3523,"Action Comedy","","Khiladi 786"
"3525",3524,"Thriller Horror","religion and supernatural blood sample occult swat team gas mask","[REC]²"
"3526",3525,"Comedy Music Family","","Standing Ovation"
"3527",3526,"Comedy Crime Drama","chicago bet horse race repayment con man","The Sting"
"3528",3527,"Drama History","underdog scotland jewry patriotism olympic games","Chariots of Fire"
"3529",3528,"Comedy Drama Romance","","Diary of a Mad Black Woman"
"3530",3529,"Drama","letter jumping child prodigy pool pianist","Shine"
"3531",3530,"Romance Comedy Drama","pornography sex sex addiction male female relationship internet porn","Don Jon"
"3532",3531,"Western","gunslinger desperation outlaw","High Plains Drifter"
"3533",3532,"Comedy Drama","high school friends art class record collector plaster personal ad","Ghost World"
"3534",3533,"Drama Romance","based on novel new love love of one's life retiree aging","Iris"
"3535",3534,"Comedy Science_Fiction","android harley davidson cryogenics space travel love","Galaxina"
"3536",3535,"Drama","penalty choir diary musical boy's choir","The Chorus"
"3537",3536,"Comedy Romance","gay father son relationship sex italo-american lovesickness","Mambo Italiano"
"3538",3537,"Crime Drama Mystery Thriller","robbery junkie investigation porno star murder","Wonderland"
"3539",3538,"Drama","black people italo-american police brutality sun glasses culture clash","Do the Right Thing"
"3540",3539,"Drama","gambling sex college basketball mafia","Harvard Man"
"3541",3540,"Drama Comedy","poverty policeman shoe shiner northern france","Le Havre"
"3542",3541,"Drama Thriller Crime Mystery","paris prostitute rape sex nudity","Irreversible"
"3543",3542,"Comedy Drama","dominatrix bdsm","R100"
"3544",3543,"Drama","new delhi india students' movement war of independence student celebration","Rang De Basanti"
"3545",3544,"Drama","","Animals"
"3546",3545,"Comedy Thriller Action Drama","pastor church service spirituality religion","Salvation Boulevard"
"3547",3546,"Comedy","independent film ventriloquist dummy multiple storylines sabbath brain scan","The Ten"
"3548",3547,"Drama Comedy Foreign","rejection friendship youth","A Room for Romeo Brass"
"3549",3548,"Thriller Crime","death of lover art thief art gallery police investigation","Headhunters"
"3550",3549,"Science_Fiction Comedy Thriller Horror","monster ireland drunk beheaded","Grabbers"
"3551",3550,"Comedy Drama","sport independent film","Saint Ralph"
"3552",3551,"Drama","love triangle love irish valet woman director","Miss Julie"
"3553",3552,"Science_Fiction Drama Fantasy Romance","time travel playwright 1910s","Somewhere in Time"
"3554",3553,"Drama Action Crime Foreign","goa drug bust rave party","Dum Maaro Dum"
"3555",3554,"Horror Thriller","haunted house possession demon family ghost","Insidious: Chapter 2"
"3556",3555,"Horror","riddle serial killer","Saw II"
"3557",3556,"Thriller Science_Fiction Drama","kidnapping bunker paranoia basement survivalist","10 Cloverfield Lane"
"3558",3557,"Documentary Comedy","disgust pain stunts music video stuntman","Jackass: The Movie"
"3559",3558,"Horror Thriller","suicide darkness basement based on short story fear of the dark","Lights Out"
"3560",3559,"Horror","witch sister sister relationship sequel prequel haunting","Paranormal Activity 3"
"3561",3560,"Horror","death of a friend swimming pool ouija ouija board teenager","Ouija"
"3562",3561,"Horror Thriller","group therapy nightmare hypnosis trapped alcoholic","A Nightmare on Elm Street 3: Dream Warriors"
"3563",3562,"Comedy Drama","bachelor vespa","Instructions Not Included"
"3564",3563,"Horror","garage poltergeist webcam imaginary friend bathtub","Paranormal Activity 4"
"3565",3564,"Drama","crucifixion ancient rome","The Robe"
"3566",3565,"Comedy","robbery diamant c\u00f4te d'azur inspector panther","The Return of the Pink Panther"
"3567",3566,"Horror Thriller Comedy","amnesia nightmare alternate dimension psychologist memory loss","Freddy's Dead: The Final Nightmare"
"3568",3567,"Crime Drama","female nudity prostitute rape sexual abuse desperation","Monster"
"3569",3568,"Adventure Drama Science_Fiction","diving ocean submarine jules verne captain","20,000 Leagues Under the Sea"
"3570",3569,"Horror Thriller","supernatural demon found footage","Paranormal Activity: The Marked Ones"
"3571",3570,"Drama History","exploitation biography hospital curiosity sideshow","The Elephant Man"
"3572",3571,"Drama History","women aids biography based on true story hiv","Dallas Buyers Club"
"3573",3572,"Thriller Horror","terror experiment afterlife paranormal violence","The Lazarus Effect"
"3574",3573,"Mystery Thriller","individual insulin tattoo waitress amnesia","Memento"
"3575",3574,"Horror","hallucination supernatural mirror skepticism ghost","Oculus"
"3576",3575,"Comedy","independent film aftercreditsstinger duringcreditsstinger","Clerks II"
"3577",3576,"Drama Comedy Music","workers' quarter dancing class strike northern england scholarship","Billy Elliot"
"3578",3577,"Comedy Drama","shyness beach bicycle conversation friendship","The Way Way Back"
"3579",3578,"Comedy","","House Party 2"
"3580",3579,"Family Drama Action Western Romance","regret river horse ranch australia","The Man from Snowy River"
"3581",3580,"Animation Family Comedy","journalism dance daydream friendship pollution","Doug's 1st Movie"
"3582",3581,"Drama","christianity coma jealousy radio station texas","The Apostle"
"3583",3582,"Drama","ax biography sociopath lawyer mansion","Mommie Dearest"
"3584",3583,"Comedy Drama","brother sister relationship sister sister relationship family clan idealist duringcreditsstinger","Our Idiot Brother"
"3585",3584,"Action Drama","olympic games biography sport historical figure nazi germany","Race"
"3586",3585,"Drama","strip club stripper dominatrix cat fight","The Players Club"
"3587",3586,"Horror Thriller","paris treasure catacombs scientist singing in a car","As Above, So Below"
"3588",3587,"Drama Thriller","infidelity obsession lie sin interracial relationship","Addicted"
"3589",3588,"Drama","sister sister relationship menstruation superstition independent film curse","Eve's Bayou"
"3590",3589,"Drama","mother professor illness","Still Alice"
"3591",3590,"History Drama","egypt","The Egyptian"
"3592",3591,"Action Crime Thriller","","Nighthawks"
"3593",3592,"Horror Thriller","new york boat mask psychopath high school","Friday the 13th Part VIII: Jason Takes Manhattan"
"3594",3593,"Comedy Drama Romance","usa parents kids relationship greece culture clash midlife crisis","My Big Fat Greek Wedding"
"3595",3594,"Drama Crime","female nudity sex florida drug dealer nudity","Spring Breakers"
"3596",3595,"Horror Thriller","mass murder nudity halloween attempt to escape cult","Halloween: The Curse of Michael Myers"
"3597",3596,"Drama Romance","mexico sex beach group sex male friendship","Y Tu Mamá También"
"3598",3597,"Horror Comedy","record collection flower cheese pub surrey","Shaun of the Dead"
