"","index","genres","keywords","title"
"960",959,"Action Thriller","fight inuit petrol company alaska","On Deadly Ground"
"961",960,"Adventure Family Science_Fiction","imaginary friend outcast","The Adventures of Sharkboy and Lavagirl"
"962",961,"Drama Adventure Romance Thriller","hippie exotic island beach map group dynamics","The Beach"
"963",962,"Drama Comedy Romance","new york pastor world of fasion loss of parents mannequin","Raising Helen"
"964",963,"Action Crime Thriller","assassination assassin ninja fighter revenge ninja","Ninja Assassin"
"965",964,"Drama Romance","baseball trainer career legend training","For Love of the Game"
"966",965,"Drama Thriller Crime","blackmail strip club striptease police u.s. congress","Striptease"
"967",966,"Family Comedy","","Marmaduke"
"968",967,"Drama Fantasy","","Hereafter"
"969",968,"Crime Drama Thriller","detective secret fbi homicide evidence","Murder by Numbers"
"970",969,"Action Adventure Crime Thriller","competition assassination cia bank cat","Assassins"
"971",970,"Crime Drama Thriller","winter psychopath horror serial killer","Hannibal Rising"
"972",971,"Comedy Drama Romance","love of one's life therapist psychology wedding relationship","The Story of Us"
"973",972,"Action Adventure Romance Science_Fiction Thriller","based on novel mass murder dystopia genocide alien invasion","The Host"
"974",973,"Action Drama Mystery Thriller Crime","drug addiction military court panama military service court","Basic"
"975",974,"Crime Drama Mystery Thriller","houseboat heart investigation police ex-cop","Blood Work"
"976",975,"Drama Thriller Crime","duringcreditsstinger","The International"
"977",976,"Action Adventure Science_Fiction Thriller","prison usa president earthquake dystopia attempt to escape","Escape from L.A."
"978",977,"Adventure Animation Family Fantasy Science_Fiction","cold war friendship giant robot sitting on a toilet fear of unknown","The Iron Giant"
"979",978,"Adventure Comedy Drama","ocean film making loss of mother cynic red cap","The Life Aquatic with Steve Zissou"
"980",979,"War Action Drama History Thriller","slavery american civil war","Free State of Jones"
"981",980,"Drama Thriller Crime","prison journalist texas professor death penalty","The Life of David Gale"
"982",981,"Comedy Action","","Man of the House"
"983",982,"Action Crime Drama Mystery Thriller","hitman revenge murder on the run mobster","Run All Night"
"984",983,"Thriller Crime Mystery","london england gay male nudity female nudity father son relationship","Eastern Promises"
"985",984,"Action Thriller Adventure Crime","diving cocaine shipwreck sailing airplane","Into the Blue"
"986",985,"Adventure Drama Action History War","schizophrenia france rape siege biography","The Messenger: The Story of Joan of Arc"
"987",986,"Comedy","kidnapping traitor virgin prince princess","Your Highness"
"988",987,"Drama Thriller Mystery","house fire extension ladder last day on job","Dream House"
"989",988,"Action Drama Thriller","journalist museum hostage drama independent film","Mad City"
"990",989,"Action Adventure Comedy Family","baby hoodlum lost child","Baby's Day Out"
"991",990,"Drama History Romance","based on novel burning of witches puritan pregnancy period drama","The Scarlet Letter"
"992",991,"Drama Thriller","cia nuclear scientist iraq politician duringcreditsstinger","Fair Game"
"993",992,"Action Crime","bounty hunter fbi weapon spectacle","Domino"
"994",993,"Action Thriller Mystery Romance","callgirl san francisco investigation murder","Jade"
"995",994,"Action Thriller Science_Fiction","dystopia mind control gun battle wrongful imprisonment dystopic future","Gamer"
"996",995,"Fantasy Drama Romance","civil war southern usa magic light dark","Beautiful Creatures"
"997",996,"Comedy Crime Drama Thriller","corruption moderator tv show success irish mob","Death to Smoochy"
"998",997,"Comedy","stupidity sequel fashion male model fashion model","Zoolander 2"
"999",998,"Comedy Crime","hotel robbery based on novel judge hawaii","The Big Bounce"
"1000",999,"Comedy Drama Romance Science_Fiction","noises alien life-form erection neue frau alien","What Planet Are You From?"
"1001",1000,"Fantasy Thriller Action Crime","bone car explosion premarital sex satanic cult driver's license","Drive Angry"
"1002",1001,"Action Adventure Science_Fiction Thriller","martial arts revenge street fighter based on video game","Street Fighter: The Legend of Chun-Li"
"1003",1002,"Action Science_Fiction Thriller","dual identity","The One"
"1004",1003,"Action Comedy Thriller Crime Mystery","rock and roll show business rock star heavy metal murder","The Adventures of Ford Fairlane"
"1005",1004,"Drama Comedy","great britain musical rock pirate radio swinging 60s","The Boat That Rocked"
"1006",1005,"Thriller Drama Crime","usa war on drugs drug traffic drug dealer drug smuggle","Traffic"
"1007",1006,"Adventure Action","saving the world venice holy grail library riddle","Indiana Jones and the Last Crusade"
"1008",1007,"Drama Romance","based on novel st. petersburg russia high society imperial russia tragic death","Anna Karenina"
"1009",1008,"Crime Action Science_Fiction","artificial intelligence android robot near future robot cop","Chappie"
"1010",1009,"Drama Mystery Thriller Crime","paraplegic investigation psychopath","The Bone Collector"
"1011",1010,"Crime Drama Thriller","burglar bunker housebreaking safe money","Panic Room"
"1012",1011,"Horror","gore slasher single mother tooth fairy woodchipper","The Tooth Fairy"
"1013",1012,"Action Adventure Comedy","gold gulf war three kings iraq kuwait","Three Kings"
"1014",1013,"Crime Thriller","based on novel soviet union russian murder serial killer","Child 44"
"1015",1014,"Adventure Comedy","casino running preisgeld millionaire road movie","Rat Race"
"1016",1015,"Drama Science_Fiction","robbery dream hypnosis investigation murder","K-PAX"
"1017",1016,"Comedy Fantasy Romance Science_Fiction","lover (female) love of one's life time travel kiss past","Kate & Leopold"
"1018",1017,"Fantasy Comedy Romance","love of one's life mephisto wish sale of soul pact with the devil","Bedazzled"
"1019",1018,"Music Drama Crime Romance","jazz jazz musician musical mafia","The Cotton Club"
"1020",1019,"Western","saloon hero liberation of prisoners transport of prisoners wilderness","3:10 to Yuma"
"1021",1020,"Thriller Action","revenge murder on the run fugitive framed","Taken 3"
"1022",1021,"Romance Comedy Crime","journalist bedroom purse trunk elmore leonard","Out of Sight"
"1023",1022,"Comedy Drama Thriller","prison prostitute karaoke dark comedy cable guy","The Cable Guy"
"1024",1023,"Drama","based on novel war of independence period drama woman director partition","Earth"
"1025",1024,"Adventure Action Comedy Thriller Crime","corruption crime fighter gangster boss investigation based on comic strip","Dick Tracy"
"1026",1025,"Drama Crime Romance","martinique claude monet famous painting glider insurance agent","The Thomas Crown Affair"
"1027",1026,"Comedy Drama Romance","baby becoming an adult puberty dream drug addiction","Riding in Cars with Boys"
"1028",1027,"Action Adventure Thriller War","prison vietnam veteran falsely accused police brutality sheriff","First Blood"
"1029",1028,"Drama Science_Fiction Adventure Mystery","1970s loss of sense of reality extraterrestrial technology subconsciousness russian","Solaris"
"1030",1029,"Animation Comedy Family Fantasy Science_Fiction","dwarves cinderella wolf bad mother-in-law prince","Happily N'Ever After"
"1031",1030,"Drama Horror Thriller Romance","servant monster laboratory jekyll and hyde housemaid","Mary Reilly"
"1032",1031,"Comedy Romance","karaoke marriage proposal new love love of one's life kiss","My Best Friend's Wedding"
"1033",1032,"Comedy Romance","film business film producer wife husband relationship fictitious marriage married couple","America's Sweethearts"
"1034",1033,"Crime Mystery Thriller","detective confession fbi homicide blackmail","Insomnia"
"1035",1034,"Science_Fiction Action Adventure Thriller","federation starfleet borg enterprise-e cyborg","Star Trek: First Contact"
"1036",1035,"Action Western Drama Fantasy Thriller","gunslinger usa dc comics hell facial scar","Jonah Hex"
"1037",1036,"Drama Thriller Mystery War","gulf war pilot u.s. army praise rescue mission","Courage Under Fire"
"1038",1037,"Comedy","california workaholic birthday lie pregnancy and birth","Liar Liar"
"1039",1038,"Crime Drama Thriller","undercover biography drug drug lord","The Infiltrator"
"1040",1039,"Drama History War","","Inchon"
"1041",1040,"Fantasy Comedy Family","manager jealousy bad mother-in-law adoption family's daily life","The Flintstones"
"1042",1041,"Action Crime Thriller","kidnapping turkey police chase bag over head violence","Taken 2"
"1043",1042,"Comedy","horror spoof","Scary Movie 3"
"1044",1043,"Comedy Crime Action","undercover agent beauty contest terrorism","Miss Congeniality"
"1045",1044,"Action Science_Fiction Adventure Comedy Family","volcano prehistoric dinosaur prehistoric creature 3d","Journey to the Center of the Earth"
"1046",1045,"Comedy Drama Family Romance","coronation duty marriage falling in love","The Princess Diaries 2: Royal Engagement"
"1047",1046,"Drama Mystery Thriller Crime","judge professor mission of murder supreme court","The Pelican Brief"
"1048",1047,"Drama Thriller Crime Mystery","suicide brother brother relationship witness protection principal witness  brother","The Client"
"1049",1048,"Drama Comedy","africa himalaya brain tumor wife husband relationship sense of life","The Bucket List"
"1050",1049,"Drama Action Thriller Crime","assassination assassin repayment ira jack ryan","Patriot Games"
"1051",1050,"Romance Comedy","bad mother-in-law surgeon dogsitter falling in love","Monster-in-Law"
"1052",1051,"Drama Thriller Crime","pennsylvania kidnapping maze vigilante rural setting","Prisoners"
"1053",1052,"Action Crime Drama Thriller","police brutality war on drugs drug traffic drug dealer los angeles","Training Day"
"1054",1053,"Comedy Family Science_Fiction","space battle spaceship spoof fictional tv show","Galaxy Quest"
"1055",1054,"Comedy","sex exorcism secret door","Scary Movie 2"
"1056",1055,"Comedy Family Music","musical the muppets robot oil tycoon studio tour","The Muppets"
"1057",1056,"Horror Action","suicide hero vampire bite fistfight","Blade"
"1058",1057,"Drama","black people autoritian education sport high school scholarship","Coach Carter"
"1059",1058,"Action Adventure Crime Thriller","new york custody battle suspense lawyer","Changing Lanes"
"1060",1059,"Adventure Horror Thriller","amazon jungle anaconda film crew killer snake","Anaconda"
"1061",1060,"Comedy","bar musical beautiful woman","Coyote Ugly"
"1062",1061,"Comedy Romance Drama","london england male nudity female nudity love at first sight usa president","Love Actually"
"1063",1062,"Adventure Animation Comedy Family","winter fight ant invention collector","A Bug's Life"
"1064",1063,"Horror Mystery Thriller","loss of family drug addiction jack the ripper","From Hell"
"1065",1064,"Action Thriller","explosive revenge explosives expert","The Specialist"
"1066",1065,"Comedy Drama Romance","lover (female) golf man-woman relation sport woman between two men","Tin Cup"
"1067",1066,"Comedy Drama Family","nurse widow children parent sibling","Yours, Mine and Ours"
"1068",1067,"Romance Comedy Family","father son relationship generations confilct sport amateur soccer soccer coach","Kicking & Screaming"
"1069",1068,"Adventure Comedy Family Science_Fiction","bureaucracy england dolphin android based on novel","The Hitchhiker's Guide to the Galaxy"
"1070",1069,"Comedy Drama Family","","Fat Albert"
"1071",1070,"Horror Action Science_Fiction","clone mutant post-apocalyptic dystopia conspiracy","Resident Evil: Extinction"
"1072",1071,"Comedy","africa blind date relationship family vacation family","Blended"
"1073",1072,"Adventure Comedy Drama","","Last Holiday"
"1074",1073,"Action Adventure Crime Thriller","river robber boston bank robber marriage crisis","The River Wild"
"1075",1074,"Adventure Family Fantasy","cupboard games puppet parallel world toy comes to life","The Indian in the Cupboard"
"1076",1075,"Crime Drama Thriller","widow american abroad eye gouging dea agent shot in the shoulder","Savages"
"1077",1076,"Action Adventure Crime Thriller","bank mobile phone telephone weapon police","Cellular"
"1078",1077,"Adventure Action Comedy","spy hero queen intelligence coronation","Johnny English"
"1079",1078,"Fantasy Adventure Animation Comedy Family","ant child hero shrinking ant-hill children","The Ant Bully"
"1080",1079,"Action Science_Fiction Adventure","prophecy witch monster telepathy atomic bomb","Dune"
"1081",1080,"Adventure Drama Music Romance","riot protest musical music cultural difference","Across the Universe"
"1082",1081,"Drama Romance","adultery jealousy infidelity career marriage crisis","Revolutionary Road"
"1083",1082,"Action Adventure Crime Thriller","mission of murder male bonding doing the right thing people change","16 Blocks"
"1084",1083,"Action Adventure Science_Fiction Thriller","submarine baby secret future mercenary","Babylon A.D."
"1085",1084,"Action Adventure Crime Drama Thriller","secret agent past cop series of murders homicide detective","The Glimmer Man"
"1086",1085,"Comedy Fantasy Science_Fiction","clone mistake in person cloning experiment gone wrong construction","Multiplicity"
"1087",1086,"Adventure Comedy Family Fantasy Science_Fiction","alien comedy duringcreditsstinger beforecreditsstinger live action and animation","Aliens in the Attic"
"1088",1087,"Crime Drama Mystery Thriller","promise murder drawing porcupine pledge","The Pledge"
"1089",1088,"Comedy Music","cheating adolf hitler success music blonde","The Producers"
"1090",1089,"Adventure Action","secret identity gold gangster boss phantom silver","The Phantom"
"1091",1090,"Drama Romance Western","dancing chess prisoner coffin wrong accusal","All the Pretty Horses"
"1092",1091,"History Drama","usa president presidential election watergate scandal biography government","Nixon"
"1093",1092,"Thriller Mystery","london england cia war crimes tony blair author","The Ghost Writer"
"1094",1093,"Adventure Action Horror Science_Fiction","ocean liner sea monster jewel heist armed robbery","Deep Rising"
"1095",1094,"Drama War","black people world war ii toscana village soldier","Miracle at St. Anna"
"1096",1095,"Action Drama Fantasy","poison china martial arts swordplay fight","Curse of the Golden Flower"
"1097",1096,"Action Crime Thriller","assassin asia gun deaf-mute hitman","Bangkok Dangerous"
"1098",1097,"Action Comedy Thriller","gadfly","Big Trouble"
"1099",1098,"Drama Romance","sex marriage proposal new love colombia letter","Love in the Time of Cholera"
"1100",1099,"Action Thriller","","Shadow Conspiracy"
"1101",1100,"Crime Adventure Action Comedy Thriller","buddhist monk cooking prime minister kitchen secret agent","Johnny English Reborn"
"1102",1101,"Animation Action Comedy Family","supermarket fight product placement computer animation food","Foodfight!"
"1103",1102,"Drama Thriller","cia wife husband relationship document revolution hiding place","Argo"
"1104",1103,"Adventure Action Thriller Crime Mystery","chicago showdown undercover surgeon death sentence","The Fugitive"
"1105",1104,"Action","bounty hunter ex-husband ex-wife relationship","The Bounty Hunter"
"1106",1105,"Crime Drama Thriller","child abuse sadistic sexual abuse pastor repayment","Sleepers"
"1107",1106,"Action Adventure Thriller War","usa vietnam veteran submachine gun prisoner prisoners of war","Rambo: First Blood Part II"
"1108",1107,"Drama Thriller","jurors blackmail court case son trial","The Juror"
"1109",1108,"Animation Family","italy lie magic fairy pinocchio","Pinocchio"
"1110",1109,"Action Drama History Western","montana showdown brothel marshal dance","Heaven's Gate"
"1111",1110,"Fantasy Action Science_Fiction Thriller","budapest key vampire light werewolf","Underworld: Evolution"
"1112",1111,"Drama Science_Fiction Thriller","london england human experimentation frankenstein reanimated corpse frankenstein's monster","Victor Frankenstein"
"1113",1112,"Drama","upper class brother brother relationship scotland poetry based on novel","Finding Forrester"
"1114",1113,"Comedy Drama","alcoholism urteil car crash wedding withdrawal","28 Days"
"1115",1114,"Action Crime","martial arts hitman serial killer","Unleashed"
"1116",1115,"Romance Comedy","roommate marriage aftercreditsstinger duringcreditsstinger","The Sweetest Thing"
"1117",1116,"Drama Mystery Thriller","fbi law tennessee lawyer law firm","The Firm"
"1118",1117,"Drama","brother brother relationship based on novel sailing ghost young adult","Charlie St. Cloud"
"1119",1118,"Action Thriller Crime","poison chicago prostitute martial arts assassin","The Mechanic"
"1120",1119,"Action Comedy Crime","male friendship high school parody crude humor based on tv series","21 Jump Street"
"1121",1120,"Romance Comedy Drama","london england bookshop birthday new love film maker","Notting Hill"
"1122",1121,"Animation Comedy Family","chicken freedom escape chicken farm pie machine","Chicken Run"
"1123",1122,"Comedy Romance","beach honeymoon bride chance risk","Along Came Polly"
"1124",1123,"Comedy Romance","role of women ladykiller success ladies' man chefin","Boomerang"
"1125",1124,"Action Comedy Crime","boston fbi buddy comedy","The Heat"
"1126",1125,"Drama History Romance","ancient rome historical figure cleopatra julius caesar","Cleopatra"
"1127",1126,"Comedy","high school teacher prize money physics teacher fighting movie budget cutting","Here Comes the Boom"
"1128",1127,"Drama Mystery Thriller Crime","based on novel witness village court love","High Crimes"
"1129",1128,"Comedy Drama Romance","sex professor wedding woman director columbia university","The Mirror Has Two Faces"
"1130",1129,"Drama Horror Mystery","based on novel small town dream motel hallucination","The Mothman Prophecies"
"1131",1130,"Comedy","gay fame mockumentary hollywood lgbt","Brüno"
"1132",1131,"Adventure Action Thriller","corruption florida secret identity liberation of prisoners drug traffic","Licence to Kill"
"1133",1132,"Fantasy Thriller Horror","winter fantasy fairy tale hood werewolf","Red Riding Hood"
"1134",1133,"Action Crime Thriller","new york female nudity prison prostitute rape","15 Minutes"
"1135",1134,"Adventure Comedy Family Fantasy","saving the world brother brother relationship royalty dinosaur based on video game","Super Mario Bros."
"1136",1135,"Crime Drama Thriller","cold war weapon arms dealer","Lord of War"
"1137",1136,"Drama Adventure Action History","countryside loss of lover right and justice patriot","Hero"
"1138",1137,"Action Comedy Crime","bounty hunter based on novel romance framed bail jumper","One for the Money"
"1139",1138,"Action Comedy","cia coup d'etat north korea assassination attempt evil dictator","The Interview"
"1140",1139,"Adventure Fantasy Action Western Thriller","assassin small town forest revenge deception","The Warrior's Way"
"1141",1140,"Action Comedy Crime","unemployment contortionist human cannonball","Micmacs"
"1142",1141,"Drama","individual street gang adolescence rap music hip-hop","8 Mile"
"1143",1142,"Adventure Comedy Animation","animation evolution humanity","Why I Did (Not) Eat My Father"
"1144",1143,"Adventure Drama Romance Action","poetry knight tournament duel torture","A Knight's Tale"
"1145",1144,"Thriller Fantasy Action Comedy","detective medallion leather jacket wretch fighter","The Medallion"
"1146",1145,"Mystery Thriller Drama","child abuse sense of guilt loss of child confidence psychology","The Sixth Sense"
"1147",1146,"Action Thriller Crime","deception new york city rooftop diamond heist framed for a crime","Man on a Ledge"
"1148",1147,"Comedy","helicopter based on novel honeymoon airplane birding","The Big Year"
"1149",1148,"Drama","flat taskmaster karate egg kids and family","The Karate Kid"
"1150",1149,"Drama Crime","con artist scam mobster fbi agent","American Hustle"
"1151",1150,"Comedy Romance Drama","fictitious marriage deportation immigration law romantic comedy alaska","The Proposal"
"1152",1151,"Crime Drama Mystery Thriller","prison sailboat sailing trip new orleans women's prison","Double Jeopardy"
"1153",1152,"Adventure Comedy Family Science_Fiction","skateboarding flying car car race delorean lightning","Back to the Future Part II"
"1154",1153,"Action Science_Fiction","artificial intelligence telepathy intelligence drug mule telekinesis","Lucy"
"1155",1154,"Drama Romance Thriller","based on novel perversion spanking billionaire bdsm","Fifty Shades of Grey"
"1156",1155,"Action Adventure Comedy Family Science_Fiction","video game intelligence liberation child hero mission","Spy Kids 3-D: Game Over"
"1157",1156,"Crime Drama Thriller","ku klux klan rape mississippi jurors blackmail","A Time to Kill"
"1158",1157,"Comedy","big family new job aspiring actor smart kid","Cheaper by the Dozen"
"1159",1158,"Action Drama Thriller War","war survival navy seal military dangerous mission","Lone Survivor"
"1160",1159,"Comedy","baseball world war ii sport baseball player female athlete","A League of Their Own"
"1161",1160,"Horror","london england england 1970s spirit single mother","The Conjuring 2"
"1162",1161,"Drama","hacker hacking creator frat party social network","The Social Network"
"1163",1162,"Comedy Romance Drama","relationship ensemble cast duringcreditsstinger","He's Just Not That Into You"
"1164",1163,"Comedy","haunted house alien life-form riesen-ipod","Scary Movie 4"
"1165",1164,"Horror Mystery","mask metal detector film director ex-cop reporter","Scream 3"
"1166",1165,"Adventure Comedy Family Science_Fiction","railroad robber california delorean indian territory sports car","Back to the Future Part III"
"1167",1166,"Comedy","prison training framed embezzlement","Get Hard"
"1168",1167,"Romance Horror","adultery maze vampire bite remake","Dracula"
"1169",1168,"Romance Drama","cooking book cookbook blog recipe","Julie & Julia"
"1170",1169,"Drama","baseball biography sport brooklyn dodgers","42"
"1171",1170,"Thriller Crime Drama","venice italy gay new york lovesickness","The Talented Mr. Ripley"
"1172",1171,"Comedy","friendship sequel road movie buddy comedy","Dumb and Dumber To"
"1173",1172,"Adventure Drama Family","expedition pilot survival sled dogs seal","Eight Below"
"1174",1173,"Comedy","intern woman director","The Intern"
"1175",1174,"Action Comedy","police sequel police officer brother-in-law brother-in-law relationship black men","Ride Along 2"
"1176",1175,"Action Adventure Drama History Romance","secret love mohawk native american 18th century french and indian war","The Last of the Mohicans"
"1177",1176,"Drama Music","black people soul country music loss of brother 1970s","Ray"
"1178",1177,"Action Thriller Crime","dystopia based on comic book held captive based on graphic novel black and white and color","Sin City"
"1179",1178,"Drama Action Thriller Crime","bomb terror spain usa president terrorist","Vantage Point"
"1180",1179,"Comedy","poker bondage duringcreditsstinger","I Love You, Man"
"1181",1180,"Comedy Romance","overweight beauty hypnosis overweight man overweight woman","Shallow Hal"
"1182",1181,"Drama Thriller History","assassination cia homophobia new orleans vietnam war","JFK"
"1183",1182,"Comedy Crime","undercover nanny computer virus stress undercover agent","Big Momma's House 2"
"1184",1183,"Action Comedy Crime Romance","kidnapping pistol","The Mexican"
"1185",1184,"Comedy","high school bullying high school sports fake identity adult as a child","17 Again"
"1186",1185,"Comedy Romance","infidelity revenge unfaithful boyfriend woman sitting on a toilet","The Other Woman"
"1187",1186,"Horror Mystery","car race dying and death plan stock-car-race car crash","The Final Destination"
"1188",1187,"Thriller Drama","spy cia cold war soviet union pilot","Bridge of Spies"
"1189",1188,"Action Drama Thriller War","helicopter war crimes sniper bosnia and herzegovina fighter pilot","Behind Enemy Lines"
"1190",1189,"Comedy","aftercreditsstinger","Get Him to the Greek"
"1191",1190,"Drama Romance Comedy","jealousy wife husband relationship dancing master","Shall We Dance?"
"1192",1191,"Comedy Adventure Fantasy Science_Fiction Action","defense industry toy shop technical toy soldier prototype","Small Soldiers"
"1193",1192,"Action Adventure Fantasy Horror Science_Fiction","anti hero secret agent fistfight based on comic book burn victim","Spawn"
"1194",1193,"Action Adventure Drama Thriller","loss of lover lover (female) ex-lover torture napoleon bonaparte","The Count of Monte Cristo"
"1195",1194,"Crime Drama Thriller","judge arrest jury private investigator","The Lincoln Lawyer"
"1196",1195,"Action Mystery Thriller","taxi hotel coma taxi driver prince","Unknown"
"1197",1196,"Drama Mystery Thriller","competition secret obsession magic dying and death","The Prestige"
"1198",1197,"Comedy","prison kidnapping sequel car chase sex addict","Horrible Bosses 2"
"1199",1198,"Animation Comedy Adventure Family Science_Fiction","spaceship alien rescue escape planet","Escape from Planet Earth"
"1200",1199,"Action Adventure Drama Thriller","loss of family solar eclipse slavery jaguar village","Apocalypto"
"1201",1200,"Action Adventure Thriller","london england smuggling of arms prison england assassination","The Living Daylights"
"1202",1201,"Action Science_Fiction Adventure Thriller","hunter predator yakuza hunting human beings alien life-form","Predators"
"1203",1202,"Comedy Crime Drama Romance Thriller","court case client lawyer courtroom","Legal Eagles"
"1204",1203,"Thriller Mystery","alcohol adultery detective mississippi jealousy","Secret Window"
