"","index","genres","keywords","title"
"1",0,"Action Adventure Fantasy Science_Fiction","culture clash future space war space colony society","Avatar"
"2",1,"Adventure Fantasy Action","ocean drug abuse exotic island east india trading company love of one's life","Pirates of the Caribbean: At World's End"
"3",2,"Action Adventure Crime","spy based on novel secret agent sequel mi6","Spectre"
"4",3,"Action Crime Drama Thriller","dc comics crime fighter terrorist secret identity burglar","The Dark Knight Rises"
"5",4,"Action Adventure Science_Fiction","based on novel mars medallion space travel princess","John Carter"
"6",5,"Fantasy Action Adventure","dual identity amnesia sandstorm love of one's life forgiveness","Spider-Man 3"
"7",6,"Animation Family","hostage magic horse fairy tale musical","Tangled"
"8",7,"Action Adventure Science_Fiction","marvel comic sequel superhero based on comic book vision","Avengers: Age of Ultron"
"9",8,"Adventure Fantasy Family","witch magic broom school of witchcraft wizardry","Harry Potter and the Half-Blood Prince"
"10",9,"Action Adventure Fantasy","dc comics vigilante superhero based on comic book revenge","Batman v Superman: Dawn of Justice"
"11",10,"Adventure Fantasy Action Science_Fiction","saving the world dc comics invulnerability sequel superhero","Superman Returns"
"12",11,"Adventure Action Thriller Crime","killing undercover secret agent british secret service","Quantum of Solace"
"13",12,"Adventure Fantasy Action","witch fortune teller bondage exotic island monster","Pirates of the Caribbean: Dead Man's Chest"
"14",13,"Action Adventure Western","texas horse survivor texas ranger partner","The Lone Ranger"
"15",14,"Action Adventure Fantasy Science_Fiction","saving the world dc comics superhero based on comic book superhuman","Man of Steel"
"16",15,"Adventure Family Fantasy","based on novel fictional place brother sister relationship lion human being","The Chronicles of Narnia: Prince Caspian"
"17",16,"Science_Fiction Action Adventure","new york shield marvel comic superhero based on comic book","The Avengers"
"18",17,"Adventure Action Fantasy","sea captain mutiny sword prime minister","Pirates of the Caribbean: On Stranger Tides"
"19",18,"Action Comedy Science_Fiction","time travel time machine alien fictional government agency seeing the future","Men in Black 3"
"20",19,"Action Adventure Fantasy","corruption elves dwarves orcs middle-earth (tolkien)","The Hobbit: The Battle of the Five Armies"
"21",20,"Action Adventure Fantasy","loss of father vigilante serum marvel comic scientific experiment","The Amazing Spider-Man"
"22",21,"Action Adventure","robin hood archer knight sherwood forest bow and arrow","Robin Hood"
"23",22,"Adventure Fantasy","elves dwarves orcs hobbit dragon","The Hobbit: The Desolation of Smaug"
"24",23,"Adventure Fantasy","england compass experiment lordship uncle","The Golden Compass"
"25",24,"Adventure Drama Action","film business screenplay show business film making film producer","King Kong"
"26",25,"Drama Romance Thriller","shipwreck iceberg ship panic titanic","Titanic"
"27",26,"Adventure Action Science_Fiction","civil war war marvel comic sequel superhero","Captain America: Civil War"
"28",27,"Thriller Action Adventure Science_Fiction","fight u.s. navy mind reading hong kong soccer","Battleship"
"29",28,"Action Adventure Science_Fiction Thriller","monster dna tyrannosaurus rex velociraptor island","Jurassic World"
"30",29,"Action Adventure Thriller","spy secret agent sociopath killer art gallery","Skyfall"
"31",30,"Action Adventure Fantasy","dual identity love of one's life pizza boy marvel comic sequel","Spider-Man 2"
"32",31,"Action Adventure Science_Fiction","terrorist war on terror tennessee malibu marvel comic","Iron Man 3"
"33",32,"Family Fantasy Adventure","based on novel fictional place queen fantasy alice in wonderland","Alice in Wonderland"
"34",33,"Adventure Action Science_Fiction Thriller","mutant marvel comic based on comic book superhuman beast","X-Men: The Last Stand"
"35",34,"Animation Family","monster dormitory games animation best friend","Monsters University"
"36",35,"Science_Fiction Action Adventure","egypt sun chaos symbol artifact","Transformers: Revenge of the Fallen"
"37",36,"Science_Fiction Action Adventure","sequel alien transformers giant robot robot","Transformers: Age of Extinction"
"38",37,"Fantasy Adventure Family","circus witch magic hope illusion","Oz: The Great and Powerful"
"39",38,"Action Adventure Fantasy","obsession marvel comic sequel based on comic book electrocution","The Amazing Spider-Man 2"
"40",39,"Adventure Action Science_Fiction","artificial intelligence secret identity computer program dystopia computer","TRON: Legacy"
"41",40,"Animation Family Adventure Comedy","car race sequel comedy anthropomorphism best friend","Cars 2"
"42",41,"Adventure Action Thriller Science_Fiction","dc comics transformation superhero alien alien infection","Green Lantern"
"43",42,"Animation Family Comedy","hostage college toy barbie animation","Toy Story 3"
"44",43,"Action Science_Fiction Thriller","saving the world artificial intelligence prophecy san francisco cyborg","Terminator Salvation"
"45",44,"Action","car race speed revenge suspense car","Furious 7"
"46",45,"Action Drama Horror Science_Fiction Thriller","dystopia apocalypse zombie nuclear weapons multiple perspectives","World War Z"
"47",46,"Action Adventure Fantasy Science_Fiction","1970s mutant time travel marvel comic based on comic book","X-Men: Days of Future Past"
"48",47,"Action Adventure Science_Fiction","spacecraft friendship sequel futuristic space","Star Trek Into Darkness"
"49",48,"Action Family Fantasy","based on fairy tale giant","Jack the Giant Slayer"
"50",49,"Drama Romance","based on novel infidelity obsession hope 3d","The Great Gatsby"
"51",50,"Adventure Fantasy Action Romance","persia sandstorm brother against brother armageddon regent","Prince of Persia: The Sands of Time"
"52",51,"Action Science_Fiction Adventure","dystopia giant robot giant monster apocalypse imax","Pacific Rim"
"53",52,"Action Science_Fiction Adventure","moon spacecraft traitor bodyguard alien planet","Transformers: Dark of the Moon"
"54",53,"Adventure Action","saving the world riddle whip treasure mexico city","Indiana Jones and the Kingdom of the Crystal Skull"
"55",54,"Adventure Animation Family","tyrannosaurus rex friends alternate history dinosaur fear","The Good Dinosaur"
"56",55,"Animation Adventure Comedy Family Action","scotland rebel bravery kingdom archer","Brave"
"57",56,"Action Adventure Science_Fiction","sequel stranded hatred space opera","Star Trek Beyond"
"58",57,"Animation Family","romantic comedy","WALL·E"
"59",58,"Action Comedy Crime Thriller","ambassador","Rush Hour 3"
"60",59,"Action Adventure Science_Fiction","civilization natural disaster end of the world disaster apocalypse","2012"
"61",60,"Animation Drama","holiday based on novel victorian england money christmas eve","A Christmas Carol"
"62",61,"Science_Fiction Fantasy Action Adventure","jupiter space woman director 3d interspecies romance","Jupiter Ascending"
"63",62,"Action Adventure","africa feral child tarzan jungle animal attack","The Legend of Tarzan"
"64",63,"Adventure Family Fantasy","saving the world witch based on novel brother sister relationship self sacrifice","The Chronicles of Narnia: The Lion, the Witch and the Wardrobe"
"65",64,"Science_Fiction","mutant supernatural powers marvel comic superhero based on comic book","X-Men: Apocalypse"
"66",65,"Drama Action Crime Thriller","dc comics crime fighter secret identity scarecrow sadism","The Dark Knight"
"67",66,"Animation Comedy Family Adventure","age difference central and south america balloon animation floating in the air","Up"
"68",67,"Animation Family Adventure Science_Fiction","alien giant robot duringcreditsstinger","Monsters vs Aliens"
"69",68,"Action Science_Fiction Adventure","middle east arms dealer malibu marvel comic superhero","Iron Man"
"70",69,"Adventure Drama Family","library clock film director key toy","Hugo"
"71",70,"Action Adventure Comedy Science_Fiction Western","steampunk based on tv series steam locomotive drag","Wild Wild West"
"72",71,"Adventure Action Fantasy","","The Mummy: Tomb of the Dragon Emperor"
"73",72,"Action Adventure Crime Fantasy Science_Fiction","dc comics shared universe anti hero secret mission villain","Suicide Squad"
"74",73,"Fantasy Comedy Family","father son relationship daily life married couple support father","Evan Almighty"
"75",74,"Action Science_Fiction","deja vu time warp restart dystopia war","Edge of Tomorrow"
"76",75,"Adventure Action","ocean tattoo mutant water dystopia","Waterworld"
"77",76,"Adventure Action Thriller Science_Fiction","terrorist secret hostage technology warhead","G.I. Joe: The Rise of Cobra"
"78",77,"Drama Comedy Animation Family","dream cartoon imaginary friend animation family","Inside Out"
"79",78,"Family Adventure Drama Fantasy","based on novel snake wolf elephant tiger","The Jungle Book"
"80",79,"Adventure Action Science_Fiction","malibu marvel comic superhero based on comic book revenge","Iron Man 2"
"81",80,"Adventure Fantasy Drama","queen magic fairy tale immortality forest","Snow White and the Huntsman"
"82",81,"Fantasy Adventure Action Family Romance","fairy tale villain sleeping beauty dark fantasy based on fairy tale","Maleficent"
"83",82,"Science_Fiction Action Drama Thriller","leader colony post-apocalyptic dystopia forest","Dawn of the Planet of the Apes"
"84",83,"Action Adventure Science_Fiction Romance","","The Lovers"
"85",84,"Drama Action Adventure Fantasy","japan suicide samurai based on true story samurai sword","47 Ronin"
"86",85,"Action Adventure Science_Fiction","washington d.c. future shield marvel comic superhero","Captain America: The Winter Soldier"
"87",86,"Comedy Adventure Fantasy Animation Family","ogre 3d","Shrek Forever After"
"88",87,"Adventure Family Mystery Science_Fiction","inventor apocalypse destiny imax dreamer","Tomorrowland"
"89",88,"Adventure Family Animation Action Comedy","brother brother relationship hero talent revenge best friend","Big Hero 6"
"90",89,"Family Animation Comedy Adventure","support group product placement bullying racing arcade","Wreck-It Ralph"
"91",90,"Adventure Animation Family Fantasy","santa claus nerd faith gift bell","The Polar Express"
"92",91,"Action Adventure Science_Fiction","alternate history alien invasion","Independence Day: Resurgence"
"93",92,"Fantasy Adventure Animation Family","flying blacksmith arena island night","How to Train Your Dragon"
"94",93,"Action Thriller Science_Fiction","saving the world artificial intelligence man vs machine cyborg killer robot","Terminator 3: Rise of the Machines"
"95",94,"Action Science_Fiction Adventure","marvel comic spaceship space outer space orphan","Guardians of the Galaxy"
"96",95,"Adventure Drama Science_Fiction","saving the world artificial intelligence father son relationship single parent nasa","Interstellar"
"97",96,"Action Thriller Science_Fiction Mystery Adventure","loss of lover dream kidnapping sleep subconsciousness","Inception"
"98",97,"Action Adventure Drama Horror Science_Fiction","monster godzilla giant monster destruction kaiju","Shin Godzilla"
"99",98,"Adventure Fantasy Action","riddle elves dwarves orcs middle-earth (tolkien)","The Hobbit: An Unexpected Journey"
"100",99,"Action Crime Thriller","street gang car race undercover auto-tuning los angeles","The Fast and the Furious"
"101",100,"Fantasy Drama Thriller Mystery Romance","diary navy funeral tea travel","The Curious Case of Benjamin Button"
"102",101,"Action Science_Fiction Adventure","cia mutant mine marvel comic superhero","X-Men: First Class"
"103",102,"Action Adventure Science_Fiction","revolution strong woman dystopia game of death 3d","The Hunger Games: Mockingjay - Part 2"
"104",103,"Fantasy Adventure Action Comedy Drama","witch fire wolf fountain magic","The Sorcerer's Apprentice"
"105",104,"Adventure Action Drama Thriller","new year's eve fire drowning cataclysm loss of father","Poseidon"
"106",105,"Fantasy","based on novel clock queen sequel alice in wonderland","Alice Through the Looking Glass"
"107",106,"Fantasy Adventure Animation Comedy Family","ambush sadness stage liberation of prisoners island","Shrek the Third"
"108",107,"Action Adventure Fantasy","video game elves orcs magic chase","Warcraft"
"109",108,"Science_Fiction Action Thriller Adventure","saving the world artificial intelligence cyborg killer robot future","Terminator Genisys"
"110",109,"Adventure Family Fantasy","based on novel magic good vs evil king narnia","The Chronicles of Narnia: The Voyage of the Dawn Treader"
"111",110,"History Romance War","nurse patriotism hawaii world war ii pilot","Pearl Harbor"
"112",111,"Adventure Science_Fiction Action","destroy transformation alien based on toy transformers","Transformers"
"113",112,"War History Action Adventure Drama","aristotle egypt greece persia elephant","Alexander"
"114",113,"Adventure Fantasy Family Mystery","prophecy witch loss of lover magic cutting the cord","Harry Potter and the Order of the Phoenix"
"115",114,"Adventure Fantasy Family","magic dying and death broom sorcerer's apprentice school of witchcraft","Harry Potter and the Goblet of Fire"
"116",115,"Fantasy Action","flying alcohol love of one's life forbidden love lovers","Hancock"
"117",116,"Drama Horror Action Thriller Science_Fiction","saving the world lost civilisation post-apocalyptic dystopia matter of life and death","I Am Legend"
"118",117,"Adventure Comedy Family Fantasy","london england father son relationship chocolate factory worker based on novel","Charlie and the Chocolate Factory"
"119",118,"Animation Comedy Family Fantasy","paris brother brother relationship expensive restaurant river cook","Ratatouille"
"120",119,"Action Crime Drama","himalaya martial arts dc comics crime fighter secret identity","Batman Begins"
"121",120,"Family Animation","africa jealousy dance hunger lion","Madagascar: Escape 2 Africa"
"122",121,"Adventure Fantasy Action Comedy Family","museum theodore roosevelt duringcreditsstinger amelia earhart smithsonian","Night at the Museum: Battle of the Smithsonian"
"123",122,"Adventure Action Thriller Science_Fiction","corruption mutant boxer army marvel comic","X-Men Origins: Wolverine"
"124",123,"Adventure Action Thriller Science_Fiction","saving the world artificial intelligence man vs machine flying philosophy","The Matrix Revolutions"
"125",124,"Animation Adventure Family","queen musical princess betrayal snowman","Frozen"
"126",125,"Adventure Action Thriller Science_Fiction","saving the world artificial intelligence man vs machine martial arts kung fu","The Matrix Reloaded"
"127",126,"Action Adventure Fantasy","marvel comic superhero based on comic book hostile takeover norse mythology","Thor: The Dark World"
"128",127,"Action Adventure Science_Fiction Thriller","future chase post-apocalyptic dystopia australia","Mad Max: Fury Road"
"129",128,"Thriller Mystery","rome vatican based on novel symbolism christian","Angels & Demons"
"130",129,"Adventure Fantasy Action","new mexico banishment shield marvel comic hammer","Thor"
"131",130,"Animation Family Adventure Comedy","hamster kids and family animal cat vs dog duringcreditsstinger","Bolt"
"132",131,"Fantasy Action Adventure Family Comedy","dyr duringcreditsstinger","G-Force"
"133",132,"Adventure","underworld hades mythology greek mythology zeus","Wrath of the Titans"
"134",133,"Comedy Fantasy","witch imprisonment vampire curse fish out of water","Dark Shadows"
"135",134,"Action Adventure Thriller","london england spy austria villain sequel","Mission: Impossible - Rogue Nation"
"136",135,"Drama Horror Thriller","father son relationship victorian england remake rural setting werewolf","The Wolfman"
"137",136,"Family Animation Adventure Comedy","factory worker tennis flower florist flower shop","Bee Movie"
"138",137,"Animation Family","martial arts hope fleet panda mission","Kung Fu Panda 2"
"139",138,"Action Adventure Family Fantasy","fire ice war ship prince kingdom","The Last Airbender"
"140",139,"Adventure Action Thriller","berlin cia vatican white house secret identity","Mission: Impossible III"
"141",140,"Action Drama Thriller","usa president conspiracy secret service the white house","White House Down"
"142",141,"Adventure Animation Family","boy alien rescue martian alien abduction","Mars Needs Moms"
"143",142,"Adventure Animation Comedy Family","london england underworld return ship frog","Flushed Away"
"144",143,"Adventure Family Fantasy","flying magic fairy tale peter pan mermaid","Pan"
"145",144,"Animation Adventure Family","father son relationship egypt intelligence adoption time travel","Mr. Peabody & Sherman"
"146",145,"Adventure Drama War","brother brother relationship adultery mythology beauty trojan war","Troy"
"147",146,"Animation Family","madagascar 3d","Madagascar 3: Europe's Most Wanted"
"148",147,"Adventure Action Thriller","laser british secret service secret service agent space based weapon","Die Another Day"
"149",148,"Action Fantasy Comedy","female friendship ghost hunting reboot ghost","Ghostbusters"
"150",149,"Action Thriller Science_Fiction Adventure","saving the world paris moon cataclysm asteroid","Armageddon"
"151",150,"Action Adventure Comedy Science_Fiction","saving the world secret identity sun glasses undercover space marine","Men in Black II"
"152",151,"Adventure Action Animation","denmark nordic mythology lie pride and vanity folk hero","Beowulf"
"153",152,"Action Adventure Animation Comedy Family","china martial arts kung fu village panda","Kung Fu Panda 3"
"154",153,"Action Thriller Adventure","fight sequel mission explosion broken arm","Mission: Impossible - Ghost Protocol"
"155",154,"Fantasy Animation Family","dream santa claus nightmare easter bunny tooth fairy","Rise of the Guardians"
"156",155,"Comedy","based on novel desperation robber hold-up robbery remake","Fun with Dick and Jane"
"157",156,"Drama Action War History","japan war crimes sense of guilt swordplay general","The Last Samurai"
"158",157,"Adventure Drama Action","moses bible ancient egypt 3d ramses","Exodus: Gods and Kings"
"159",158,"Science_Fiction Action Adventure","spacecraft teleportation space mission parachute time travel","Star Trek"
"160",159,"Fantasy Action","loss of lover spider thanksgiving bad boss hostility","Spider-Man"
"161",160,"Fantasy Action Adventure Animation Comedy","father son relationship wife husband relationship sacrifice viking sequel","How to Train Your Dragon 2"
"162",161,"Fantasy","egypt underworld fight mythology nile","Gods of Egypt"
"163",162,"Action","artificial intelligence u.s. navy aftercreditsstinger","Stealth"
"164",163,"Action Mystery Science_Fiction","dc comics secret identity mass murder retirement based on comic book","Watchmen"
"165",164,"Action Adventure Comedy Crime Thriller","lapd house on fire revolver","Lethal Weapon 4"
"166",165,"Drama Action Science_Fiction","california san francisco monster general gun","Hulk"
"167",166,"Adventure Action Science_Fiction Thriller","terror assassin secret technology missile","G.I. Joe: Retaliation"
"168",167,"Action Adventure Comedy Drama Mystery","tyrant ironclad ship","Sahara"
"169",168,"Adventure Action Animation Fantasy Science_Fiction","battle assignment dystopia alien downfall scientist","Final Fantasy: The Spirits Within"
"170",169,"Action Adventure Science_Fiction","new york usa world war ii nazis marvel comic","Captain America: The First Avenger"
"171",170,"Adventure Action Thriller","british mission oil heiress bilbao spain","The World Is Not Enough"
"172",171,"Adventure","naturalist frigate self surgery sea battle weevil","Master and Commander: The Far Side of the World"
"173",172,"Adventure Fantasy Drama Romance","vampire romance villainess super strength imprinting","The Twilight Saga: Breaking Dawn - Part 2"
"174",173,"Animation Comedy Family","penguin musical aftercreditsstinger 3d","Happy Feet Two"
"175",174,"Science_Fiction Action Adventure","new york rio de janeiro marvel comic superhero based on comic book","The Incredible Hulk"
"176",175,"Adventure Family Fantasy","london england england based on novel queen little girl","The BFG"
"177",176,"Western Drama Adventure Thriller","father son relationship rape based on novel mountains winter","The Revenant"
"178",177,"Animation Family","underdog car race dream speed power","Turbo"
"179",178,"Animation Comedy Family Western Adventure","sheriff nevada pet rango chameleon","Rango"
"180",179,"Family Animation Adventure Comedy","penguin madagascar 3d","Penguins of Madagascar"
"181",180,"Action Drama Mystery Thriller","paris corruption madrid assassin based on novel","The Bourne Ultimatum"
"182",181,"Adventure Animation Family Comedy","china martial arts kung fu mentor snake","Kung Fu Panda"
"183",182,"Science_Fiction Action Adventure","marvel comic superhero based on comic book aftercreditsstinger duringcreditsstinger","Ant-Man"
"184",183,"Adventure Action Science_Fiction","competition based on novel mentor secret factory","The Hunger Games: Catching Fire"
"185",184,"Fantasy Comedy Animation Science_Fiction Family","friendship spaceship space alien alien invasion","Home"
"186",185,"Adventure Thriller Science_Fiction","post traumatic stress  disorder new jersey airplane dystopia daughter","War of the Worlds"
"187",186,"Adventure Action Comedy Thriller Crime","miami ku klux klan cuba undercover mexican standoff","Bad Boys II"
"188",187,"Action Adventure Animation Family Fantasy","adventure fairy-tale figure","Puss in Boots"
"189",188,"Action Mystery Thriller","assassination spy cia kidnapping cold war","Salt"
"190",189,"Drama Adventure","bible god noah 3d","Noah"
"191",190,"Adventure Animation Mystery","riddle captain treasure liquor treasure hunt","The Adventures of Tintin"
"192",191,"Adventure Fantasy Family","flying traitor magic cutting the cord child hero","Harry Potter and the Prisoner of Azkaban"
"193",192,"Drama","missionary world war ii ranch australia british","Australia"
"194",193,"Science_Fiction Action Adventure","dystopia","After Earth"
"195",194,"Animation Family","cataclysm asteroid leader comet animation","Dinosaur"
"196",195,"Adventure Comedy Fantasy Family","night watchman museum natural history history smithsonian","Night at the Museum: Secret of the Tomb"
"197",196,"Animation Action Comedy Family Science_Fiction","saving the world date prison secret identity fish","Megamind"
"198",197,"Adventure Fantasy Family","witch christmas party magic cutting the cord halloween","Harry Potter and the Philosopher's Stone"
"199",198,"Fantasy Action Comedy Crime","gold police operation partner revenge undead","R.I.P.D."
"200",199,"Adventure Fantasy Action","exotic island blacksmith east india trading company gold marriage proposal","Pirates of the Caribbean: The Curse of the Black Pearl"
"201",200,"Science_Fiction Adventure Thriller","resistance post-apocalyptic dystopia war sequel","The Hunger Games: Mockingjay - Part 1"
"202",201,"Thriller Mystery","paris holy grail christianity monk based on novel","The Da Vinci Code"
"203",202,"Animation Adventure Comedy Family","bird sequel jungle audition amazon rainforest","Rio 2"
"204",203,"Adventure Action Science_Fiction Thriller","mutant marvel comic superhero based on comic book superhuman","X2"
"205",204,"Action Thriller Crime","brazil fbi freedom escape from prison car crash","Fast Five"
"206",205,"Adventure Action Crime Mystery","detective inspector steampunk criminal mastermind","Sherlock Holmes: A Game of Shadows"
"207",206,"Adventure Fantasy Action","hades mythology greek mythology zeus medusa","Clash of the Titans"
"208",207,"Action Adventure Science_Fiction","oxygen falsely accused resistance mars double life","Total Recall"
"209",208,"Adventure Fantasy Action","witch cave arabian scandinavia bagdad","The 13th Warrior"
"210",209,"Action Thriller","assassin wolf maryland suicide by gunshot rooftop","The Bourne Legacy"
"211",210,"Action Crime Fantasy","double life dc comics dual identity crime fighter fictional place","Batman & Robin"
"212",211,"Family Comedy Fantasy","holiday christmas party new love santa claus village","How the Grinch Stole Christmas"
"213",212,"Action Adventure Science_Fiction Thriller","saving the world library cataclysm climate change greenhouse effect","The Day After Tomorrow"
"214",213,"Adventure Action Thriller","terror spain cia helicopter secret identity","Mission: Impossible II"
"215",214,"Drama","u.s. air force grocery jamaican meteorologist rescue boat","The Perfect Storm"
"216",215,"Adventure Fantasy Action Thriller","fire helicopter surfboard mask satellite","Fantastic 4: Rise of the Silver Surfer"
"217",216,"Adventure Drama Action","ocean shipwreck hindu tiger faith","Life of Pi"
"218",217,"Thriller Action Fantasy Horror","mephisto religion and supernatural dying and death devil's son ghost world","Ghost Rider"
"219",218,"Action Thriller","assassin amnesia flashback","Jason Bourne"
"220",219,"Action Adventure Comedy","robbery secret identity secret agent","Charlie's Angels: Full Throttle"
"221",220,"Science_Fiction Adventure Mystery","android dystopia alien spin off creation","Prometheus"
"222",221,"Family Adventure Animation Comedy","mouse falcon bird friendship family","Stuart Little 2"
"223",222,"Science_Fiction Action Drama Thriller","dystopia space station class conflict","Elysium"
"224",223,"Action Science_Fiction","prison dystopia matter of life and death outer space intergalactic travel","The Chronicles of Riddick"
"225",224,"Action Science_Fiction","cyborg future dystopia police remake","RoboCop"
"226",225,"Action Family Science_Fiction","car race loss of brother chimp family duringcreditsstinger","Speed Racer"
